### ISSUE TITLE
Why is radvd sending RA every second?

### ISSUE THREAD

**Issue by shallpion** [reubenhwk/radvd#51]
Hi, I encountered a weird problem about my radvd-2.11 on a linux box being used as a router. It has two interfaces,enp4s0 is used as WAN and receives pd from my ISP and radvd runs on enp6s0 (LAN).
```javascript
root@debian:~# ip -6 addr show enp6s0 | grep fe80
inet6 fe80::230:18ff:fec7:acae/64 scope link 
```
The following is my radvd.conf
```javascript
interface enp6s0 # LAN interface
{
	AdvManagedFlag off; 
	AdvOtherConfigFlag off; 
	AdvSendAdvert on;
	MinRtrAdvInterval 300;
	MaxRtrAdvInterval 600;
	AdvDefaultPreference high;
	AdvDefaultLifetime 7200;
	AdvLinkMTU 1280;

	prefix ::/64
	{
		AdvOnLink on;
		AdvAutonomous on;
		AdvValidLifetime 36000;
 		AdvPreferredLifetime 36000;
	};
};
```
However tcpdump on enp6s0 shows that it is sending ra every second despite of this config:
```javascript
root@debian:~# tcpdump -i enp6s0 icmp6 
tcpdump: verbose output suppressed, use -v or -vv for full protocol decode
listening on enp6s0, link-type EN10MB (Ethernet), capture size 262144 bytes
00:22:57.963326 IP6 fe80::230:18ff:fec7:acae > ip6-allnodes: ICMP6, router advertisement, length 64
00:22:58.965028 IP6 fe80::230:18ff:fec7:acae > ip6-allnodes: ICMP6, router advertisement, length 64
00:22:59.967183 IP6 fe80::230:18ff:fec7:acae > ip6-allnodes: ICMP6, router advertisement, length 64
00:23:00.969545 IP6 fe80::230:18ff:fec7:acae > ip6-allnodes: ICMP6, router advertisement, length 64
00:23:01.971727 IP6 fe80::230:18ff:fec7:acae > ip6-allnodes: ICMP6, router advertisement, length 64
00:23:02.973771 IP6 fe80::230:18ff:fec7:acae > ip6-allnodes: ICMP6, router advertisement, length 64
```

**Comment by shallpion** [comment]
After further investigation, it appears that radvd "reloads" itself every second after perhaps 3 or 4 seconds since it is loaded. I did the following test:
```javascript
root@debian:~# radvd -d 4
[Dec 20 01:14:26] radvd (29435): enp6s0 is up
[Dec 20 01:14:26] radvd (29435): enp6s0 is running
[Dec 20 01:14:26] radvd (29435): enp6s0 supports multicast
root@debian:~# [Dec 20 01:14:30] radvd (29435): enp6s0 is up <--now it starts to reload
[Dec 20 01:14:30] radvd (29435): enp6s0 is running
[Dec 20 01:14:30] radvd (29435): enp6s0 supports multicast
[Dec 20 01:14:31] radvd (29435): enp6s0 is up
[Dec 20 01:14:31] radvd (29435): enp6s0 is running
[Dec 20 01:14:31] radvd (29435): enp6s0 supports multicast
[Dec 20 01:14:31] radvd (29435): enp6s0 is up
[Dec 20 01:14:31] radvd (29435): enp6s0 is running
[Dec 20 01:14:31] radvd (29435): enp6s0 supports multicast
[Dec 20 01:14:32] radvd (29435): enp6s0 is up
[Dec 20 01:14:32] radvd (29435): enp6s0 is running
[Dec 20 01:14:32] radvd (29435): enp6s0 supports multicast
[Dec 20 01:14:32] radvd (29435): enp6s0 is up
[Dec 20 01:14:32] radvd (29435): enp6s0 is running
[Dec 20 01:14:32] radvd (29435): enp6s0 supports multicast
```
Please notice what happened at 01:14:26. As a reference, I set MinRtrAdvInterval to be 3 and MaxRtrAdvInterval to be 4 and did another tcpdump, and here is the result:
```javascript
root@debian:~# tcpdump -i enp6s0 icmp6 
tcpdump: verbose output suppressed, use -v or -vv for full protocol decode
listening on enp6s0, link-type EN10MB (Ethernet), capture size 262144 bytes

01:14:26.180108 IP6 fe80::230:18ff:fec7:acae > ip6-allnodes: ICMP6, router advertisement, length 96
01:14:30.181541 IP6 fe80::230:18ff:fec7:acae > ip6-allnodes: ICMP6, router advertisement, length 96
01:14:31.186227 IP6 fe80::230:18ff:fec7:acae > ip6-allnodes: ICMP6, router advertisement, length 96 <--it begins
01:14:32.191110 IP6 fe80::230:18ff:fec7:acae > ip6-allnodes: ICMP6, router advertisement, length 96
01:14:33.196402 IP6 fe80::230:18ff:fec7:acae > ip6-allnodes: ICMP6, router advertisement, length 96
01:14:34.202505 IP6 fe80::230:18ff:fec7:acae > ip6-allnodes: ICMP6, router advertisement, length 96
01:14:34.802684 IP6 fe80::230:18ff:fec7:acae > ip6-allnodes: ICMP6, router advertisement, length 96
```
Again, please notice that before 01:14:31 radvd correctly followed its config until it started to "re-load" itself every second afterwards.

**Comment by shallpion** [comment]
After comparing it with some earlier version, it appears this issue was introduced in 2.9, possibly related to volker's patch about "Recognize new interfaces coming up and react immediately". I am using debian stretch with dhcpcd 6.9.3, not sure if the latter is responsible though.

**Comment by reubenhwk** [comment]
Hi,

Thanks for the report.  This is a touchy bit of code in netlink.c (I think,
I'm not looking at the code right now).  RADVD listens on a netlink socket
for messages from the kernel about new interfaces coming up and going
down.  The idea is that when a network cable is plugged in, RADVD needs to
start sending adverts on it right away.

If you're not plugging and unplugging your network cable every second
(which I really doubt you are), then there's something in that code that's
too trigger happy about network interface state changes.  Can you look into
that code and find out what netlink events are triggering RADVD to reload?

One thing I've noticed before is an interface on which you're sending
adverts will autoconfigure itself with its own advert.  This triggers a
netlink message and may be the cause.  Is your interface getting a new IPv6
address on every advert?

Thanks in advance,
Reuben

**Comment by shallpion** [comment]
Hi, thank you so much for your prompt reply. I am not sure if I understood correctly as I have very little programming experience, but the followings are my further investigations of this issue, hopefully they help more or less. 

By the way, to isolate the issue, I also tried using wide-dhcpv6-client to ask pd from my ISP (I reboot my computer every time I try something new for caution) but the problem still happens. So it may not be related to dhcpcd I suspect. 

I set `MinRtrAdvInterval 5` and `MaxRtrAdvInterval 10` for testing. After the launch of radvd, `kickoff_adverts()` is called with `next=10` as 10<16. The big 
```javascript
for(;;)
```
loop in `radvd.c` starts to run with `timeout` variable in `next_interface_to_expire` counting down. Before it times out, the variable
```javascript
int rc = ppoll(fds, sizeof(fds) / sizeof(fds[0]), tsp, &sigempty);
```
in `radvd.c` stays at 1 until `timeout` finally runs out, then `rc` is seen set to 0, causing `timer_handler()` to run which consequently calls `send_ra_for_all()`. The following is a crude stdout debug output I inserted in the source code with "####...##" separating each iteration in the for loop, 
```javascript
root@debian:~/build/radvd-2.11# launching kickoff
send_ra_forall()!!!!
Called reschedule in kickoff, next: 10.000000

##############################################################
current time: 20:00:45
polling for 10 second(s), next iface is enp6s0
rc has value: 1
##############################################################
current time: 20:00:45
polling for 10 second(s), next iface is enp6s0
rc has value: 1
##############################################################
current time: 20:00:45
polling for 9.813 second(s), next iface is enp6s0
rc has value: 1
##############################################################
current time: 20:00:48
polling for 6.813 second(s), next iface is enp6s0
rc has value: 1
##############################################################
current time: 20:00:51
polling for 3.803 second(s), next iface is enp6s0
rc has value: 1
##############################################################
current time: 20:00:54
polling for 0.793 second(s), next iface is enp6s0
rc has value: 0
send_ra_forall()!!!!
Calling reschedule_iface(iface,netxt) in radvd.c/timer_handler(), next: 5.644019
##############################################################
current time: 20:00:55
polling for 10 second(s), next iface is enp6s0
rc has value: 2
Calling reschedule_iface(iface, 0) in interface.c/touch_iface()
I am setting next to IFACE_SETUP_DELAY = 1
##############################################################
current time: 20:00:55
polling for 1 second(s), next iface is enp6s0
rc has value: 0
send_ra_forall()!!!!
Calling reschedule_iface(iface,netxt) in radvd.c/timer_handler(), next: 7.855576
##############################################################
current time: 20:00:56
polling for 10 second(s), next iface is enp6s0
rc has value: 2
Calling reschedule_iface(iface, 0) in interface.c/touch_iface()
I am setting next to IFACE_SETUP_DELAY = 1
##############################################################
current time: 20:00:56
polling for 0.999 second(s), next iface is enp6s0
rc has value: 0
send_ra_forall()!!!!
Calling reschedule_iface(iface,netxt) in radvd.c/timer_handler(), next: 9.048000
##############################################################
current time: 20:00:57
polling for 10 second(s), next iface is enp6s0
rc has value: 2
Calling reschedule_iface(iface, 0) in interface.c/touch_iface()
I am setting next to IFACE_SETUP_DELAY = 1
##############################################################
current time: 20:00:57
polling for 0.999 second(s), next iface is enp6s0
rc has value: 1
##############################################################
current time: 20:00:57
polling for 0.79 second(s), next iface is enp6s0
rc has value: 0
send_ra_forall()!!!!
Calling reschedule_iface(iface,netxt) in radvd.c/timer_handler(), next: 7.370636
##############################################################
current time: 20:00:58
polling for 10 second(s), next iface is enp6s0
rc has value: 2
Calling reschedule_iface(iface, 0) in interface.c/touch_iface()
I am setting next to IFACE_SETUP_DELAY = 1
##############################################################
current time: 20:00:58
polling for 1 second(s), next iface is enp6s0
rc has value: 0
send_ra_forall()!!!!
Calling reschedule_iface(iface,netxt) in radvd.c/timer_handler(), next: 9.494367

```

I am still scratching my head about what happened to `rc`, but it almost looks to me that
"polling for 1 second(s)" makes radvd  fall into a " timeout in 1 second-->ra-->timeout in 1 second..." loop... What is even more strange is the mixed appearance of "polling for 1 second(s)" and "polling for 10 second(s)". From what I would desire, after an event happens, either ra waiting period naturally times out or cable being plugged/pulled, `reschedule_iface()` should be called and resets RA broadcast, then it should hand the timeout timer back to MaxRtrAdvInterval or so. But now the 1 second timeout looks somehow stuck there. At least it doesn't look like a real netlink event triggered it as it successfully waited `MAX_INITIAL_RTR_ADVEDRT_INTERVAL` seconds (10 in my case) before things started to go wrong. 

As a comparison, I set `IFACE_SETUP_DELAY` to a large number like 1000, and pull the ethernet cable plugged into my LAN port, and this is what happens when I pulled the cable around time 21:03:23. As it shows after a few "real netlink event" causing rc bumps to 0 it then stabilized, sitting there counting down the timeout from 1000 and waits. So it really looks like ``ppoll()`` can detect netlink event as desired and when there is no such event, `rc` is constantly returned as 1 instead of 0 for several minutes.

Hopefully I made myself clear, and thank you so much for reading.

```javascript
root@debian:~/build/radvd-2.11# launching kickoff
send_ra_forall()!!!!
Called reschedule in kickoff, next: 10.000000

##############################################################
current time: 21:02:59
polling for 10 second(s), next iface is enp6s0
rc has value: 1
##############################################################
current time: 21:02:59
polling for 10 second(s), next iface is enp6s0
rc has value: 1
##############################################################
current time: 21:03:01
polling for 7.661 second(s), next iface is enp6s0
rc has value: 1
##############################################################
current time: 21:03:04
polling for 4.651 second(s), next iface is enp6s0
rc has value: 1
##############################################################
current time: 21:03:08
polling for 1.641 second(s), next iface is enp6s0
rc has value: 0
send_ra_forall()!!!!
Calling reschedule_iface(iface,netxt) in radvd.c/timer_handler(), next: 9.097864
##############################################################
current time: 21:03:09
polling for 10 second(s), next iface is enp6s0
rc has value: 2
Calling reschedule_iface(iface, 0) in interface.c/touch_iface()
I am setting next to IFACE_SETUP_DELAY = 1000
##############################################################
current time: 21:03:09
polling for 999.999 second(s), next iface is enp6s0
rc has value: 1
##############################################################
current time: 21:03:11
polling for 998.633 second(s), next iface is enp6s0
rc has value: 1
##############################################################
current time: 21:03:14
polling for 995.623 second(s), next iface is enp6s0
rc has value: 1
##############################################################
current time: 21:03:17
polling for 992.613 second(s), next iface is enp6s0
rc has value: 1
##############################################################
current time: 21:03:20
polling for 989.603 second(s), next iface is enp6s0
rc has value: 1
##############################################################
current time: 21:03:23                                                    ### PULLED CABLE
polling for 986.593 second(s), next iface is enp6s0         ###
rc has value: 1
Calling reschedule_iface(iface, 0) in interface.c/touch_iface()
I am setting next to IFACE_SETUP_DELAY = 1000
##############################################################
current time: 21:03:24
polling for 1000 second(s), next iface is enp6s0
rc has value: 1
##############################################################
current time: 21:03:26
polling for 998.603 second(s), next iface is enp6s0
rc has value: 1
Calling reschedule_iface(iface, 0) in interface.c/touch_iface()
I am setting next to IFACE_SETUP_DELAY = 1000
##############################################################
current time: 21:03:27
polling for 1000 second(s), next iface is enp6s0
rc has value: 1
send_ra_forall()!!!!
##############################################################
current time: 21:03:28
polling for 10 second(s), next iface is enp6s0
rc has value: 2
Calling reschedule_iface(iface, 0) in interface.c/touch_iface()
I am setting next to IFACE_SETUP_DELAY = 1000
##############################################################
current time: 21:03:28
polling for 999.999 second(s), next iface is enp6s0
rc has value: 1
##############################################################
current time: 21:03:29
polling for 999.124 second(s), next iface is enp6s0
rc has value: 1
Calling reschedule_iface(iface, 0) in interface.c/touch_iface()
I am setting next to IFACE_SETUP_DELAY = 1000


...
```

**Comment by shallpion** [comment]
I forgot to paste the debug output in /var/log/syslog using debug level 5 for a typical run. As you suggested that this part does look like the cause of the "1 second timeout being stuck" and also sounds similar to what you have suggested, netlink reconfigures itself causing it falling into a loop:

```javascript
Dec 20 21:39:05 debian radvd[25609]: netlink: enp6s0, ifindex 3, new address
Dec 20 21:39:05 debian radvd[25609]: enp6s0 next scheduled RA in 1 second(s)
```
Neither the ip of my LAN port on the router or my client IP on desktop was changed due to RA though.



```javascript
Dec 20 21:38:55 debian radvd[25608]: version 2.11 started
Dec 20 21:38:55 debian radvd[25608]: all-zeros prefix in /etc/radvd.conf, line 15
Dec 20 21:38:55 debian radvd[25608]: auto-selected prefix 2604:6000:d9c5:3b01::/64 on interface enp6s0
Dec 20 21:38:55 debian radvd[25608]: prefix automatically selected, AdvRouterAddr always enabled, ignoring config line 17
Dec 20 21:38:55 debian radvd[25608]: enp6s0 interface definition ok
Dec 20 21:38:55 debian radvd[25608]: config file, /etc/radvd.conf, syntax ok
Dec 20 21:38:55 debian radvd[25608]: radvd startup PID is 25608
Dec 20 21:38:55 debian radvd[25608]: opened pid file /var/run/radvd.pid
Dec 20 21:38:55 debian radvd[25608]: locked pid file /var/run/radvd.pid
Dec 20 21:38:55 debian radvd[25609]: opened pid file /var/run/radvd.pid
Dec 20 21:38:55 debian radvd[25609]: radvd PID is 25609
Dec 20 21:38:55 debian radvd[25609]: wrote pid 25609 to pid file: /var/run/radvd.pid
Dec 20 21:38:55 debian radvd[25608]: child signaled pid file written: 25609
Dec 20 21:38:55 debian radvd[25609]: validated pid file, /var/run/radvd.pid: 25609
Dec 20 21:38:55 debian radvd[25608]: Freeing Interfaces
Dec 20 21:38:55 debian radvd[25609]: initializing privsep
Dec 20 21:38:55 debian radvd[25608]: freeing interface enp6s0
Dec 20 21:38:55 debian radvd[25609]: radvd privsep PID is 25610
Dec 20 21:38:55 debian radvd[25610]: Freeing Interfaces
Dec 20 21:38:55 debian radvd[25610]: freeing interface enp6s0
Dec 20 21:38:55 debian radvd[25609]: enp6s0 if_index changed from 0 to 3
Dec 20 21:38:55 debian radvd[25609]: ioctl(SIOCGIFFLAGS) succeeded on enp6s0
Dec 20 21:38:55 debian radvd[25609]: enp6s0 is up
Dec 20 21:38:55 debian radvd[25609]: enp6s0 is running
Dec 20 21:38:55 debian radvd[25609]: enp6s0 supports multicast
Dec 20 21:38:55 debian radvd[25609]: enp6s0 mtu: 1500
Dec 20 21:38:55 debian radvd[25609]: enp6s0 hardware type: ARPHRD_ETHER
Dec 20 21:38:55 debian radvd[25609]: enp6s0 hardware address: 00:30:18:c7:ac:ae
Dec 20 21:38:55 debian radvd[25609]: enp6s0 link layer token length: 48
Dec 20 21:38:55 debian radvd[25609]: enp6s0 prefix length: 64
Dec 20 21:38:55 debian radvd[25609]: enp6s0 linklocal address: fe80::230:18ff:fec7:acae
Dec 20 21:38:55 debian radvd[25609]: enp6s0 is ready
Dec 20 21:38:55 debian radvd[25609]: sending RA to ff02::1 on enp6s0
Dec 20 21:38:55 debian radvd[25609]: enp6s0 next scheduled RA in 10 second(s)
Dec 20 21:38:55 debian radvd[25609]: polling for 10 second(s), next iface is enp6s0
Dec 20 21:38:55 debian radvd[25609]: enp6s0 recvmsg len=64
Dec 20 21:38:55 debian radvd[25609]: enp6s0 received a packet
Dec 20 21:38:55 debian radvd[25609]: enp6s0 received RA from: fe80::230:18ff:fec7:acae
Dec 20 21:38:55 debian radvd[25609]: processed RA on enp6s0
Dec 20 21:38:55 debian radvd[25609]: polling for 9.999 second(s), next iface is enp6s0
Dec 20 21:38:55 debian radvd[25609]: enp4s0 recvmsg len=16
Dec 20 21:38:55 debian radvd[25609]: enp4s0 received a packet
Dec 20 21:38:55 debian radvd[25609]: enp4s0 received icmpv6 RS/RA packet on an unknown interface with index 2
Dec 20 21:38:55 debian radvd[25609]: polling for 9.548 second(s), next iface is enp6s0
Dec 20 21:38:58 debian radvd[25609]: enp4s0 recvmsg len=16
Dec 20 21:38:58 debian radvd[25609]: enp4s0 received a packet
Dec 20 21:38:58 debian radvd[25609]: enp4s0 received icmpv6 RS/RA packet on an unknown interface with index 2
Dec 20 21:38:58 debian radvd[25609]: polling for 6.538 second(s), next iface is enp6s0
Dec 20 21:39:01 debian radvd[25609]: enp4s0 recvmsg len=16
Dec 20 21:39:01 debian radvd[25609]: enp4s0 received a packet
Dec 20 21:39:01 debian radvd[25609]: enp4s0 received icmpv6 RS/RA packet on an unknown interface with index 2
Dec 20 21:39:01 debian radvd[25609]: polling for 3.528 second(s), next iface is enp6s0
Dec 20 21:39:04 debian radvd[25609]: enp4s0 recvmsg len=16
Dec 20 21:39:04 debian radvd[25609]: enp4s0 received a packet
Dec 20 21:39:04 debian radvd[25609]: enp4s0 received icmpv6 RS/RA packet on an unknown interface with index 2
Dec 20 21:39:04 debian radvd[25609]: polling for 0.518 second(s), next iface is enp6s0
Dec 20 21:39:05 debian radvd[25609]: timer_handler called for enp6s0
Dec 20 21:39:05 debian radvd[25609]: sending RA to ff02::1 on enp6s0
Dec 20 21:39:05 debian radvd[25609]: enp6s0 next scheduled RA in 10 second(s)
Dec 20 21:39:05 debian radvd[25609]: polling for 10 second(s), next iface is enp6s0
Dec 20 21:39:05 debian radvd[25609]: netlink: enp6s0, ifindex 3, new address
Dec 20 21:39:05 debian radvd[25609]: enp6s0 next scheduled RA in 1 second(s)
Dec 20 21:39:05 debian radvd[25609]: enp6s0 recvmsg len=64
Dec 20 21:39:05 debian radvd[25609]: enp6s0 received a packet
Dec 20 21:39:05 debian radvd[25609]: ioctl(SIOCGIFFLAGS) succeeded on enp6s0
Dec 20 21:39:05 debian radvd[25609]: enp6s0 is up
Dec 20 21:39:05 debian radvd[25609]: enp6s0 is running
Dec 20 21:39:05 debian radvd[25609]: enp6s0 supports multicast
Dec 20 21:39:05 debian radvd[25609]: enp6s0 mtu: 1500
Dec 20 21:39:05 debian radvd[25609]: enp6s0 hardware type: ARPHRD_ETHER
Dec 20 21:39:05 debian radvd[25609]: enp6s0 hardware address: 00:30:18:c7:ac:ae
Dec 20 21:39:05 debian radvd[25609]: enp6s0 link layer token length: 48
Dec 20 21:39:05 debian radvd[25609]: enp6s0 prefix length: 64
Dec 20 21:39:05 debian radvd[25609]: enp6s0 linklocal address: fe80::230:18ff:fec7:acae
Dec 20 21:39:05 debian radvd[25609]: enp6s0 is ready
Dec 20 21:39:05 debian radvd[25609]: enp6s0 received RA from: fe80::230:18ff:fec7:acae
Dec 20 21:39:05 debian radvd[25609]: processed RA on enp6s0
Dec 20 21:39:05 debian radvd[25609]: polling for 0.999 second(s), next iface is enp6s0
Dec 20 21:39:06 debian radvd[25609]: timer_handler called for enp6s0
Dec 20 21:39:06 debian radvd[25609]: sending RA to ff02::1 on enp6s0
Dec 20 21:39:06 debian radvd[25609]: enp6s0 next scheduled RA in 10 second(s)
Dec 20 21:39:06 debian radvd[25609]: polling for 10 second(s), next iface is enp6s0
Dec 20 21:39:06 debian radvd[25609]: netlink: enp6s0, ifindex 3, new address
Dec 20 21:39:06 debian radvd[25609]: enp6s0 next scheduled RA in 1 second(s)
Dec 20 21:39:06 debian radvd[25609]: enp6s0 recvmsg len=64
Dec 20 21:39:06 debian radvd[25609]: enp6s0 received a packet
Dec 20 21:39:06 debian radvd[25609]: ioctl(SIOCGIFFLAGS) succeeded on enp6s0
Dec 20 21:39:06 debian radvd[25609]: enp6s0 is up
Dec 20 21:39:06 debian radvd[25609]: enp6s0 is running
Dec 20 21:39:06 debian radvd[25609]: enp6s0 supports multicast
Dec 20 21:39:06 debian radvd[25609]: enp6s0 mtu: 1500
Dec 20 21:39:06 debian radvd[25609]: enp6s0 hardware type: ARPHRD_ETHER
Dec 20 21:39:06 debian radvd[25609]: enp6s0 hardware address: 00:30:18:c7:ac:ae
Dec 20 21:39:06 debian radvd[25609]: enp6s0 link layer token length: 48
Dec 20 21:39:06 debian radvd[25609]: enp6s0 prefix length: 64
Dec 20 21:39:06 debian radvd[25609]: enp6s0 linklocal address: fe80::230:18ff:fec7:acae
Dec 20 21:39:06 debian radvd[25609]: enp6s0 is ready
Dec 20 21:39:06 debian radvd[25609]: enp6s0 received RA from: fe80::230:18ff:fec7:acae
Dec 20 21:39:06 debian radvd[25609]: processed RA on enp6s0
Dec 20 21:39:06 debian radvd[25609]: polling for 0.998 second(s), next iface is enp6s0
Dec 20 21:39:07 debian radvd[25609]: timer_handler called for enp6s0
Dec 20 21:39:07 debian radvd[25609]: sending RA to ff02::1 on enp6s0
Dec 20 21:39:07 debian radvd[25609]: enp6s0 next scheduled RA in 10 second(s)
Dec 20 21:39:07 debian radvd[25609]: polling for 10 second(s), next iface is enp6s0
Dec 20 21:39:07 debian radvd[25609]: netlink: enp6s0, ifindex 3, new address
Dec 20 21:39:07 debian radvd[25609]: enp6s0 next scheduled RA in 1 second(s)
Dec 20 21:39:07 debian radvd[25609]: enp6s0 recvmsg len=64
Dec 20 21:39:07 debian radvd[25609]: enp6s0 received a packet
Dec 20 21:39:07 debian radvd[25609]: ioctl(SIOCGIFFLAGS) succeeded on enp6s0
Dec 20 21:39:07 debian radvd[25609]: enp6s0 is up
Dec 20 21:39:07 debian radvd[25609]: enp6s0 is running
Dec 20 21:39:07 debian radvd[25609]: enp6s0 supports multicast
Dec 20 21:39:07 debian radvd[25609]: enp6s0 mtu: 1500
Dec 20 21:39:07 debian radvd[25609]: enp6s0 hardware type: ARPHRD_ETHER
Dec 20 21:39:07 debian radvd[25609]: enp6s0 hardware address: 00:30:18:c7:ac:ae
Dec 20 21:39:07 debian radvd[25609]: enp6s0 link layer token length: 48
Dec 20 21:39:07 debian radvd[25609]: enp6s0 prefix length: 64
Dec 20 21:39:07 debian radvd[25609]: enp6s0 linklocal address: fe80::230:18ff:fec7:acae
Dec 20 21:39:07 debian radvd[25609]: enp6s0 is ready
Dec 20 21:39:07 debian radvd[25609]: enp6s0 received RA from: fe80::230:18ff:fec7:acae
Dec 20 21:39:07 debian radvd[25609]: processed RA on enp6s0
Dec 20 21:39:07 debian radvd[25609]: polling for 0.999 second(s), next iface is enp6s0
Dec 20 21:39:07 debian radvd[25609]: enp4s0 recvmsg len=16
Dec 20 21:39:07 debian radvd[25609]: enp4s0 received a packet
Dec 20 21:39:07 debian radvd[25609]: enp4s0 received icmpv6 RS/RA packet on an unknown interface with index 2
Dec 20 21:39:07 debian radvd[25609]: polling for 0.515 second(s), next iface is enp6s0
Dec 20 21:39:08 debian radvd[25609]: timer_handler called for enp6s0
Dec 20 21:39:08 debian radvd[25609]: sending RA to ff02::1 on enp6s0
Dec 20 21:39:08 debian radvd[25609]: enp6s0 next scheduled RA in 10 second(s)
Dec 20 21:39:08 debian radvd[25609]: polling for 10 second(s), next iface is enp6s0
Dec 20 21:39:08 debian radvd[25609]: netlink: enp6s0, ifindex 3, new address
Dec 20 21:39:08 debian radvd[25609]: enp6s0 next scheduled RA in 1 second(s)
Dec 20 21:39:08 debian radvd[25609]: enp6s0 recvmsg len=64
Dec 20 21:39:08 debian radvd[25609]: enp6s0 received a packet
Dec 20 21:39:08 debian radvd[25609]: ioctl(SIOCGIFFLAGS) succeeded on enp6s0
Dec 20 21:39:08 debian radvd[25609]: enp6s0 is up
Dec 20 21:39:08 debian radvd[25609]: enp6s0 is running
Dec 20 21:39:08 debian radvd[25609]: enp6s0 supports multicast
Dec 20 21:39:08 debian radvd[25609]: enp6s0 mtu: 1500
Dec 20 21:39:08 debian radvd[25609]: enp6s0 hardware type: ARPHRD_ETHER
Dec 20 21:39:08 debian radvd[25609]: enp6s0 hardware address: 00:30:18:c7:ac:ae
Dec 20 21:39:08 debian radvd[25609]: enp6s0 link layer token length: 48
Dec 20 21:39:08 debian radvd[25609]: enp6s0 prefix length: 64
Dec 20 21:39:08 debian radvd[25609]: enp6s0 linklocal address: fe80::230:18ff:fec7:acae
Dec 20 21:39:08 debian radvd[25609]: enp6s0 is ready
Dec 20 21:39:08 debian radvd[25609]: enp6s0 received RA from: fe80::230:18ff:fec7:acae
Dec 20 21:39:08 debian radvd[25609]: processed RA on enp6s0
Dec 20 21:39:08 debian radvd[25609]: polling for 0.999 second(s), next iface is enp6s0
Dec 20 21:39:09 debian radvd[25609]: timer_handler called for enp6s0
Dec 20 21:39:09 debian radvd[25609]: sending RA to ff02::1 on enp6s0
Dec 20 21:39:09 debian radvd[25609]: enp6s0 next scheduled RA in 10 second(s)
Dec 20 21:39:09 debian radvd[25609]: polling for 10 second(s), next iface is enp6s0
Dec 20 21:39:09 debian radvd[25609]: netlink: enp6s0, ifindex 3, new address
Dec 20 21:39:09 debian radvd[25609]: enp6s0 next scheduled RA in 1 second(s)
Dec 20 21:39:09 debian radvd[25609]: enp6s0 recvmsg len=64
Dec 20 21:39:09 debian radvd[25609]: enp6s0 received a packet
Dec 20 21:39:09 debian radvd[25609]: ioctl(SIOCGIFFLAGS) succeeded on enp6s0
Dec 20 21:39:09 debian radvd[25609]: enp6s0 is up
Dec 20 21:39:09 debian radvd[25609]: enp6s0 is running
Dec 20 21:39:09 debian radvd[25609]: enp6s0 supports multicast
Dec 20 21:39:09 debian radvd[25609]: enp6s0 mtu: 1500
Dec 20 21:39:09 debian radvd[25609]: enp6s0 hardware type: ARPHRD_ETHER
Dec 20 21:39:09 debian radvd[25609]: enp6s0 hardware address: 00:30:18:c7:ac:ae
Dec 20 21:39:09 debian radvd[25609]: enp6s0 link layer token length: 48
Dec 20 21:39:09 debian radvd[25609]: enp6s0 prefix length: 64
Dec 20 21:39:09 debian radvd[25609]: enp6s0 linklocal address: fe80::230:18ff:fec7:acae
Dec 20 21:39:09 debian radvd[25609]: enp6s0 is ready
Dec 20 21:39:09 debian radvd[25609]: enp6s0 received RA from: fe80::230:18ff:fec7:acae
Dec 20 21:39:09 debian radvd[25609]: processed RA on enp6s0
Dec 20 21:39:09 debian radvd[25609]: polling for 0.997 second(s), next iface is enp6s0
Dec 20 21:39:10 debian radvd[25609]: timer_handler called for enp6s0
Dec 20 21:39:10 debian radvd[25609]: sending RA to ff02::1 on enp6s0
Dec 20 21:39:10 debian radvd[25609]: enp6s0 next scheduled RA in 10 second(s)
Dec 20 21:39:10 debian radvd[25609]: polling for 10 second(s), next iface is enp6s0
Dec 20 21:39:10 debian radvd[25609]: netlink: enp6s0, ifindex 3, new address
Dec 20 21:39:10 debian radvd[25609]: enp6s0 next scheduled RA in 1 second(s)
Dec 20 21:39:10 debian radvd[25609]: enp6s0 recvmsg len=64
Dec 20 21:39:10 debian radvd[25609]: enp6s0 received a packet
Dec 20 21:39:10 debian radvd[25609]: ioctl(SIOCGIFFLAGS) succeeded on enp6s0
Dec 20 21:39:10 debian radvd[25609]: enp6s0 is up
Dec 20 21:39:10 debian radvd[25609]: enp6s0 is running
Dec 20 21:39:10 debian radvd[25609]: enp6s0 supports multicast
Dec 20 21:39:10 debian radvd[25609]: enp6s0 mtu: 1500
Dec 20 21:39:10 debian radvd[25609]: enp6s0 hardware type: ARPHRD_ETHER
Dec 20 21:39:10 debian radvd[25609]: enp6s0 hardware address: 00:30:18:c7:ac:ae
Dec 20 21:39:10 debian radvd[25609]: enp6s0 link layer token length: 48
Dec 20 21:39:10 debian radvd[25609]: enp6s0 prefix length: 64
Dec 20 21:39:10 debian radvd[25609]: enp6s0 linklocal address: fe80::230:18ff:fec7:acae
Dec 20 21:39:10 debian radvd[25609]: enp6s0 is ready
Dec 20 21:39:10 debian radvd[25609]: enp6s0 received RA from: fe80::230:18ff:fec7:acae
Dec 20 21:39:10 debian radvd[25609]: processed RA on enp6s0
Dec 20 21:39:10 debian radvd[25609]: polling for 0.999 second(s), next iface is enp6s0
Dec 20 21:39:10 debian radvd[25609]: enp4s0 recvmsg len=16
Dec 20 21:39:10 debian radvd[25609]: enp4s0 received a packet
Dec 20 21:39:10 debian radvd[25609]: enp4s0 received icmpv6 RS/RA packet on an unknown interface with index 2
Dec 20 21:39:10 debian radvd[25609]: polling for 0.519 second(s), next iface is enp6s0
Dec 20 21:39:11 debian radvd[25609]: timer_handler called for enp6s0
Dec 20 21:39:11 debian radvd[25609]: sending RA to ff02::1 on enp6s0
Dec 20 21:39:11 debian radvd[25609]: enp6s0 next scheduled RA in 10 second(s)
Dec 20 21:39:11 debian radvd[25609]: polling for 10 second(s), next iface is enp6s0
Dec 20 21:39:11 debian radvd[25609]: netlink: enp6s0, ifindex 3, new address
Dec 20 21:39:11 debian radvd[25609]: enp6s0 next scheduled RA in 1 second(s)
Dec 20 21:39:11 debian radvd[25609]: enp6s0 recvmsg len=64
Dec 20 21:39:11 debian radvd[25609]: enp6s0 received a packet
Dec 20 21:39:11 debian radvd[25609]: ioctl(SIOCGIFFLAGS) succeeded on enp6s0
Dec 20 21:39:11 debian radvd[25609]: enp6s0 is up
Dec 20 21:39:11 debian radvd[25609]: enp6s0 is running
Dec 20 21:39:11 debian radvd[25609]: enp6s0 supports multicast
Dec 20 21:39:11 debian radvd[25609]: enp6s0 mtu: 1500
Dec 20 21:39:11 debian radvd[25609]: enp6s0 hardware type: ARPHRD_ETHER
Dec 20 21:39:11 debian radvd[25609]: enp6s0 hardware address: 00:30:18:c7:ac:ae
Dec 20 21:39:11 debian radvd[25609]: enp6s0 link layer token length: 48
Dec 20 21:39:11 debian radvd[25609]: enp6s0 prefix length: 64
Dec 20 21:39:11 debian radvd[25609]: enp6s0 linklocal address: fe80::230:18ff:fec7:acae
Dec 20 21:39:11 debian radvd[25609]: enp6s0 is ready
Dec 20 21:39:11 debian radvd[25609]: enp6s0 received RA from: fe80::230:18ff:fec7:acae
Dec 20 21:39:11 debian radvd[25609]: processed RA on enp6s0
Dec 20 21:39:11 debian radvd[25609]: polling for 1 second(s), next iface is enp6s0
Dec 20 21:39:11 debian radvd[25609]: poll returned early: Interrupted system call
Dec 20 21:39:11 debian radvd[25609]: exiting, 1 sigterm(s) received
Dec 20 21:39:11 debian radvd[25609]: sending stop adverts
Dec 20 21:39:11 debian radvd[25609]: stopping all adverts on enp6s0
Dec 20 21:39:11 debian radvd[25609]: sending RA to ff02::1 on enp6s0
Dec 20 21:39:11 debian radvd[25609]: removing /var/run/radvd.pid
Dec 20 21:39:11 debian radvd[25609]: Freeing Interfaces
Dec 20 21:39:11 debian radvd[25609]: freeing interface enp6s0
Dec 20 21:39:11 debian radvd[25609]: returning from radvd main
```

**Comment by shallpion** [comment]
Okay I was being stupid, in case my interface "resets" itself, it makes perfect sense it will still receive the same IP address. So I did an ip monitoring and exactly as you suggested:
```javascript
root@debian:~/build/radvd-2.11# ip -ts monitor dev enp6s0 | grep prefix
[2015-12-20T22:25:08.912430] prefix 2604:6000:d9c5:3b01::/64 dev enp6s0 onlink autoconf valid 36000 preferred 36000 
[2015-12-20T22:25:18.914630] prefix 2604:6000:d9c5:3b01::/64 dev enp6s0 onlink autoconf valid 36000 preferred 36000 
[2015-12-20T22:25:19.917553] prefix 2604:6000:d9c5:3b01::/64 dev enp6s0 onlink autoconf valid 36000 preferred 36000 
[2015-12-20T22:25:20.920306] prefix 2604:6000:d9c5:3b01::/64 dev enp6s0 onlink autoconf valid 36000 preferred 36000 
[2015-12-20T22:25:21.922801] prefix 2604:6000:d9c5:3b01::/64 dev enp6s0 onlink autoconf valid 36000 preferred 36000 
[2015-12-20T22:25:22.925936] prefix 2604:6000:d9c5:3b01::/64 dev enp6s0 onlink autoconf valid 36000 preferred 36000 
[2015-12-20T22:25:23.927678] prefix 2604:6000:d9c5:3b01::/64 dev enp6s0 onlink autoconf valid 36000 preferred 36000 
[2015-12-20T22:25:24.929573] prefix 2604:6000:d9c5:3b01::/64 dev enp6s0 onlink autoconf valid 36000 preferred 36000 
```
The first event is caused by radvd's initial launch, it then waited for 10 seconds and reset itself over and over again each second afterwards, causing the issue.

**Comment by shallpion** [comment]
I just tried arch linux with full systemd support and the problem is gone, so it must have been debian's way to handle network interface event (stretch now uses a hybrid init system). Probably it will be resolved after its full transition to systemd. Thank you again for the suggestions. I will mark this issue as closed as this is an os-specific issue and I will try to talk to debian's maillist. Thanks :)

**Comment by cm-rudolph** [comment]
I'm encountering the same phenomenon.
It is the `RTM_NEWADDR` message that gets sent all the time. Setting `net.ipv6.conf.ethX.accept_ra` to `0` seems to have fixed the problem, `ethX` being the interface on which radvd sends announcements. Maybe I'll post further insight in a while.
